{
  "object_type": "knowledge_availability_receipt",
  "schema_version": "1.0.0",
  "receipt_id": "krc:oges.fixture.0001",
  "record_sha256": "36bd83b2841e484bc3cc78a9e1f14947df29c269cd4c73379bb8d6b9c07525e5",
  "sequence": 1,
  "previous_receipt_file_sha256": null,
  "release_id": "rel:oges.fixture.2026-08-08",
  "release_manifest_file_sha256": "4ba1ddf66f9ebf8afd0ea68119f7f23737d3462a01443b767191e5507c3ff1f1",
  "release_record_sha256": "8a9fb51b2a08b9d5f000df110a098218121bad3baec89b091bb7e542f5a70e8a",
  "release_generated_at": "2026-08-08T13:00:00Z",
  "available_at": "2026-08-08T14:00:00Z",
  "signer_id": "signer:knowledge.availability.fixture",
  "signature_path": "knowledge/receipt-signatures/0001.sig"
}
